{
  "schema_id": "OPM-DEV-CANVAS-06-COMMON-FIXTURE-CATALOG-001",
  "schema_version": "0.1",
  "catalog_id": "dev-canvas-06.common-fixtures.93805d6e2fdb",
  "catalog_version": "0.1.0",
  "generated_at": "2026-07-01T00:00:00.000Z",
  "generator_ref": {
    "kind": "GENERATOR_SOURCE",
    "path": "scripts/author-canvas06-common-fixtures.mjs",
    "byte_length": 5149,
    "sha256": "4142b065691a42c57ce627e67f5fc19acf1d22d087997f8ce11705fd43d0cebb"
  },
  "source_binding": {
    "profile": {
      "id": "profile.iso19450.2024.draft",
      "version": "0.2.0",
      "sha256": "5287d3ceb77c4c664b88c6e34a3a5d1c34f85c36037ab2f587705f9d607f899c"
    },
    "rule_set": {
      "id": "rules.iso19450.2024.draft",
      "version": "0.1.0",
      "sha256": "4293cb22cf2e2e92fe212ed3c31119992509c8a675daa554c64a2ccf10457d64"
    },
    "text_grammar": {
      "id": "grammar.opl.iso19450.2024.draft",
      "version": "0.2.0",
      "sha256": "c88e672bd9db7f0405a7ef3fc464043f15cae844931192e3412c94ce05339e7d"
    },
    "symbol_catalog": {
      "id": "symbols.iso19450.2024.draft",
      "version": "0.1.0",
      "sha256": "511dbaec2adb6f49ed6a4d28844e69d1310eb7a67f213e4a30b0ddfc21ef6098"
    },
    "normalization_adapter": {
      "id": "normalization.iso19450.2024.draft",
      "version": "0.1.0",
      "sha256": "6401336ad4b63127047ccd5d50cc418554f0c8490547a6024939b4da5774194c"
    },
    "binding_digest": "93805d6e2fdb3ea73c4ddfc0a995d662fbf13dee2d8a6f24fc20c79ecff65d1d"
  },
  "visual_subjects": [
    {
      "subject_id": "STATE_ROLES",
      "factory_id": "factory.visual.state_roles",
      "factory_source_ref": {
        "kind": "FACTORY_SOURCE",
        "path": "factories/common-fixture-factory.mjs",
        "byte_length": 2502,
        "sha256": "ba584bca062f4a24ad09a6c6881a183bd889ef3826264b90b1e19a7db7e855cb"
      },
      "fixture_ref": {
        "kind": "FIXTURE",
        "path": "visual/STATE_ROLES.json",
        "byte_length": 497,
        "sha256": "7a5156b45e7753dc47dbfcef3ecffa674380ca8d501d30fe476f6106ddfde56d"
      },
      "expected_revision": "revision.visual.state_roles",
      "focus_target_id": "fact.visual.state_roles",
      "focus_anchor": "CENTER",
      "expected_cells": 3,
      "critical_regions": [
        {
          "region_id": "FOCUS_BBOX",
          "kind": "CANVAS"
        }
      ]
    },
    {
      "subject_id": "LONG_LABELS",
      "factory_id": "factory.visual.long_labels",
      "factory_source_ref": {
        "kind": "FACTORY_SOURCE",
        "path": "factories/common-fixture-factory.mjs",
        "byte_length": 2502,
        "sha256": "ba584bca062f4a24ad09a6c6881a183bd889ef3826264b90b1e19a7db7e855cb"
      },
      "fixture_ref": {
        "kind": "FIXTURE",
        "path": "visual/LONG_LABELS.json",
        "byte_length": 497,
        "sha256": "700ff3f0cf1e8bb44af674370dd35e0f07736f21032140ada515b41e4120d304"
      },
      "expected_revision": "revision.visual.long_labels",
      "focus_target_id": "fact.visual.long_labels",
      "focus_anchor": "CENTER",
      "expected_cells": 3,
      "critical_regions": [
        {
          "region_id": "FOCUS_BBOX",
          "kind": "CANVAS"
        }
      ]
    },
    {
      "subject_id": "FUNDAMENTAL_FAN",
      "factory_id": "factory.visual.fundamental_fan",
      "factory_source_ref": {
        "kind": "FACTORY_SOURCE",
        "path": "factories/common-fixture-factory.mjs",
        "byte_length": 2502,
        "sha256": "ba584bca062f4a24ad09a6c6881a183bd889ef3826264b90b1e19a7db7e855cb"
      },
      "fixture_ref": {
        "kind": "FIXTURE",
        "path": "visual/FUNDAMENTAL_FAN.json",
        "byte_length": 529,
        "sha256": "ec0b8f130e7af184317d214eef4507960cffe1391512fd93ba23b134522437ca"
      },
      "expected_revision": "revision.visual.fundamental_fan",
      "focus_target_id": "fact.visual.fundamental_fan",
      "focus_anchor": "CENTER",
      "expected_cells": 3,
      "critical_regions": [
        {
          "region_id": "FOCUS_BBOX",
          "kind": "CANVAS"
        }
      ]
    },
    {
      "subject_id": "CANDIDATE_LAYER",
      "factory_id": "factory.visual.candidate_layer",
      "factory_source_ref": {
        "kind": "FACTORY_SOURCE",
        "path": "factories/common-fixture-factory.mjs",
        "byte_length": 2502,
        "sha256": "ba584bca062f4a24ad09a6c6881a183bd889ef3826264b90b1e19a7db7e855cb"
      },
      "fixture_ref": {
        "kind": "FIXTURE",
        "path": "visual/CANDIDATE_LAYER.json",
        "byte_length": 529,
        "sha256": "ea1721e5e3583ad8341854da1845fdb1c4f547e398d8e34df9af2d29846662fd"
      },
      "expected_revision": "revision.visual.candidate_layer",
      "focus_target_id": "fact.visual.candidate_layer",
      "focus_anchor": "CENTER",
      "expected_cells": 3,
      "critical_regions": [
        {
          "region_id": "FOCUS_BBOX",
          "kind": "CANVAS"
        }
      ]
    },
    {
      "subject_id": "INSPECTOR",
      "factory_id": "factory.visual.inspector",
      "factory_source_ref": {
        "kind": "FACTORY_SOURCE",
        "path": "factories/common-fixture-factory.mjs",
        "byte_length": 2502,
        "sha256": "ba584bca062f4a24ad09a6c6881a183bd889ef3826264b90b1e19a7db7e855cb"
      },
      "fixture_ref": {
        "kind": "FIXTURE",
        "path": "visual/INSPECTOR.json",
        "byte_length": 481,
        "sha256": "07d27d5c5848779858dc1e6554bc81e938ec5d14837ad9d19943b674e3d6ba0d"
      },
      "expected_revision": "revision.visual.inspector",
      "focus_target_id": "fact.visual.inspector",
      "focus_anchor": "CENTER",
      "expected_cells": 3,
      "critical_regions": [
        {
          "region_id": "FOCUS_BBOX",
          "kind": "CANVAS"
        }
      ]
    },
    {
      "subject_id": "TOOLCHAIN_CATALOG",
      "factory_id": "factory.visual.toolchain_catalog",
      "factory_source_ref": {
        "kind": "FACTORY_SOURCE",
        "path": "factories/common-fixture-factory.mjs",
        "byte_length": 2502,
        "sha256": "ba584bca062f4a24ad09a6c6881a183bd889ef3826264b90b1e19a7db7e855cb"
      },
      "fixture_ref": {
        "kind": "FIXTURE",
        "path": "visual/TOOLCHAIN_CATALOG.json",
        "byte_length": 545,
        "sha256": "04b5925bc3a067d16a310da2747528edd04bec3eecbe239332cda5b9f1e897a0"
      },
      "expected_revision": "revision.visual.toolchain_catalog",
      "focus_target_id": "fact.visual.toolchain_catalog",
      "focus_anchor": "CENTER",
      "expected_cells": 3,
      "critical_regions": [
        {
          "region_id": "FOCUS_BBOX",
          "kind": "CANVAS"
        }
      ]
    },
    {
      "subject_id": "FINDING_FOCUS",
      "factory_id": "factory.visual.finding_focus",
      "factory_source_ref": {
        "kind": "FACTORY_SOURCE",
        "path": "factories/common-fixture-factory.mjs",
        "byte_length": 2502,
        "sha256": "ba584bca062f4a24ad09a6c6881a183bd889ef3826264b90b1e19a7db7e855cb"
      },
      "fixture_ref": {
        "kind": "FIXTURE",
        "path": "visual/FINDING_FOCUS.json",
        "byte_length": 513,
        "sha256": "3f7cfd34ee063863ce0e6fda2881bb059c3e1d36517b40595469c17f55015126"
      },
      "expected_revision": "revision.visual.finding_focus",
      "focus_target_id": "fact.visual.finding_focus",
      "focus_anchor": "CENTER",
      "expected_cells": 3,
      "critical_regions": [
        {
          "region_id": "FOCUS_BBOX",
          "kind": "CANVAS"
        }
      ]
    },
    {
      "subject_id": "BLOCKED_FEEDBACK",
      "factory_id": "factory.visual.blocked_feedback",
      "factory_source_ref": {
        "kind": "FACTORY_SOURCE",
        "path": "factories/common-fixture-factory.mjs",
        "byte_length": 2502,
        "sha256": "ba584bca062f4a24ad09a6c6881a183bd889ef3826264b90b1e19a7db7e855cb"
      },
      "fixture_ref": {
        "kind": "FIXTURE",
        "path": "visual/BLOCKED_FEEDBACK.json",
        "byte_length": 537,
        "sha256": "ae58504350333f0671b2503b89d514e0bbacd2b4fcbadba14da08e7eae400d36"
      },
      "expected_revision": "revision.visual.blocked_feedback",
      "focus_target_id": "fact.visual.blocked_feedback",
      "focus_anchor": "CENTER",
      "expected_cells": 3,
      "critical_regions": [
        {
          "region_id": "FOCUS_BBOX",
          "kind": "CANVAS"
        }
      ]
    }
  ],
  "e2e_cases": [
    {
      "case_id": "E2E-CANVAS-001.STATE_CREATE_RENAME_ROLES",
      "factory_id": "factory.e2e.e2e-canvas-001.state_create_rename_roles",
      "factory_source_ref": {
        "kind": "FACTORY_SOURCE",
        "path": "factories/common-fixture-factory.mjs",
        "byte_length": 2502,
        "sha256": "ba584bca062f4a24ad09a6c6881a183bd889ef3826264b90b1e19a7db7e855cb"
      },
      "base_fixture_ref": {
        "kind": "FIXTURE",
        "path": "e2e/E2E-CANVAS-001.STATE_CREATE_RENAME_ROLES.base.json",
        "byte_length": 881,
        "sha256": "9b273b7a10c7fd33f8c5aec3784cd25db3f49b54efa813f092cdfa896c6809b4"
      },
      "input_ref": {
        "kind": "INPUT",
        "path": "e2e/E2E-CANVAS-001.STATE_CREATE_RENAME_ROLES.input.json",
        "byte_length": 882,
        "sha256": "a8273c396ec46dc96f5e53763b90e24ae70f3ceba5bbf8c67f168112f080a366"
      },
      "actions": [
        {
          "action_id": "action.001",
          "expected_status": "PASS_MATCHED",
          "expected_transaction": {
            "revision_delta": 1,
            "revision_parent_delta": 1,
            "text_artifact_delta": 1,
            "text_trace_delta": 1,
            "finding_delta": 0,
            "operation_delta": 1,
            "receipt_delta": 1,
            "draft_head_changed": true
          },
          "reopen_checkpoint": {
            "expected_head_changed": true,
            "projection_matches": true,
            "text_trace_matches": true
          }
        }
      ],
      "assertion_ids": [
        "REVISION_OR_BLOCKED_MATCHED",
        "REOPEN_MATCHED"
      ]
    },